{
  "schema": "talonsoclab.soc-intake/v1",
  "generated": "2026-07-20",
  "source": "talonsoclab",
  "consumer": "casa-ai-agent (github.com/ktalons/casa-ai-agent)",
  "detections": [
    {
      "level": 15,
      "description": "Directory replication (DRSUAPI GetNCChanges) requested from a host that is not a domain controller",
      "rule_id": "100220",
      "agent": "talondc01",
      "mitre": ["T1003.006"],
      "timestamp": "2026-07-20T02:19:47.418Z"
    },
    {
      "level": 13,
      "description": "Successful network logon to domain controller from a source with a preceding failed-auth burst",
      "rule_id": "100215",
      "agent": "talondc01",
      "mitre": ["T1021.002", "T1078"],
      "timestamp": "2026-07-20T02:18:22.905Z"
    },
    {
      "level": 12,
      "description": "Multiple authentication failures followed by a success from the same source",
      "rule_id": "100210",
      "agent": "talondellbox",
      "mitre": ["T1110.001"],
      "timestamp": "2026-07-20T02:17:05.223Z"
    },
    {
      "level": 12,
      "description": "Multiple authentication failures from a single source (>= 20 in 60s)",
      "rule_id": "100200",
      "agent": "talondellbox",
      "mitre": ["T1110"],
      "timestamp": "2026-07-20T02:14:31.671Z"
    }
  ],
  "recon_delta": "## Recon delta — 2026-07-20\n\n- **NEW** `talondellbox:3389/tcp` (RDP) reachable from the workstation VLAN — was filtered in the 2026-07-13 baseline.\n- Unchanged: `talondc01:445/tcp`, `talondc01:389/tcp`.\n",
  "note": "Deterministic intake. Reasoning happens in CASA, not here."
}
