{
  "schema": "talonsoclab.soc-intake/v1",
  "generated": "2026-07-22",
  "source": "talonsoclab",
  "consumer": "casa-ai-agent (github.com/ktalons/casa-ai-agent)",
  "detections": [
    {
      "level": 12,
      "description": "Periodic outbound HTTPS to a rarely-contacted external host (regular interval, low jitter)",
      "rule_id": "100305",
      "agent": "talonmacbook",
      "mitre": [
        "T1071.001"
      ],
      "timestamp": "2026-07-22T06:41:12.550Z"
    },
    {
      "level": 12,
      "description": "DNS queries to a newly-observed high-entropy domain",
      "rule_id": "100310",
      "agent": "talonmacbook",
      "mitre": [
        "T1071.004"
      ],
      "timestamp": "2026-07-22T06:39:58.104Z"
    }
  ],
  "recon_delta": "## Recon delta — 2026-07-22\n\n- **NEW** `talonmacbook:8443/tcp` responding with a self-signed TLS cert — not present in the 2026-07-15 baseline.\n",
  "note": "Deterministic intake. Reasoning happens in CASA, not here."
}
